,ID_Comments
5208,aku suka konten kamu anjinkkkkkk
5209,i dont giveafuck with a hatrs
5210,akhir sekian lama intro aku tonton habis tolol terus kok tombol aku abu yak ad tombol merah
5211,erick kok kontol ngentot bangsat anjing perkosa memek
5212,bener banget mulut erick kontol im proud of you kingg lanjut apa yg kamu suka salam soapers ngentodd
5213,ngomong kotor jelek biarin napa turun cuma buat hibur kok g kamu suka salam soapers ngentodd
5214,kalau aku bikin vidio macem bakal auto kaya ya wkakaka
5215,yg ngomong bilang lewat dm mati aja anjing tolol ampe rohhhhhhh anying sursssss
5216,i have some words for haters erick
5217,semangat terus bang usah dengerin benci benci orang goblok
5218,bang rando ikut yutub riwen bang
5219,reading haters comment sama mama kamu rik
5220,pertama kali gua nonnton youtube skip anjingg mantap erickoo knntollll sukses buat kamu hibur semua subscribe kamu a
5221,i dont give a fuck a fucking bitch
5222,syap buat konten tidak faedah tapi hibur jangan pikir haters haters piki keri haters sumber duit tidak
5223,orang indo banyak goblok gatau ngambil sisi baik
5224,aku selalu dukung kamu kok njing h h
5225,ajg kata kalau jt subscribe kamu ken botak ajg boong mulu kamu kontol
5226,bang gua masuk haters elu aku nge pens sama kamu bang terus aja karya bang
5227,ericko lim punya otak
5228,kalau suka gausaaahh tonton semudahh ituu
5229,biarin apa kata orang orang bang terus karya thanks udah ngehibur gua orang orang pinter bakal tau mana buat canda mana baik
5230,lumayan haters banyak uang lancar anjing
5231,bang aku suka sama konten kamu semangat
5232,yg dislike haters
5233,ric kamu bikin video lucu kaya yakult sih ric
5234,bang bang cuekin aja kamu mending jadi soap king dahh
5235,orang erikcolim tahan sama nama haters
5236,kamu kya kontol aku suap krep wkwkwkkwkwk
5237,be yourself d
5238,wkwk w ngeliat nya tertawa anjing
5239,semenjak gua moveon game mobile legend toxic gua perlahan ilang
5240,anjerr iklan aku kok bisa skip xd
5241,kagak tod
5242,sama bro
5243,wkwkwkw sma broo
5244,wkwkwk gaya ericko emang mantul gada obat
5245,udah jelas anjengg dia yg penting adsense lancar
5246,bang nya subscribe kamu benci
5247,bang bikin vidio masa susah kamu dong bang
5248,rik bikin konten kamu minum sperma kamu rik pasti bakal buming bangt dari lain kamu orang pertama bikin kontak pasti kamu jadi lbh buming eriko lim minum sperma bnyak poin kamu terus bnyak subkribe saran aku konten nya
5249,baca tod kapan kamu tobat toxic
5250,enak haters tambah adsande
5251,haters ibarat orang kaya
5252,ciaaa bocah kontol
5253,dingin gtuu
5254,ah goblok kamu bangsat cuman tau toxic aja bodoh coba tobat
5255,semangat bang ericko lim
5256,malam bisa tidur abis baca komentar
5257,toxic bukan arti kasar kalau toxic kasar knp erickolim situ tonton welcome to indonesia everywhere toxic make we famaous
5258,hahaha bocah kontol bikin tertawa anjing
5259,kamu jelek
5260,eriko kontolll muka nya sangek
5261,erick emang gitu kalau kagak ngetoxic beda karena cirikhasnya kntl emang ngehibur ea so kalian semua kontol gede kamu tidak suka jan bct bocah aja cihhh
5262,video video kamu kaga pernah yang nama give away
5263,intro keren anjing
5264,intro dora woy anjeng
5265,baju eric baju dwp tahun lalu njir
5266,bang bahasa jqga
5267,bang coba kamu jangan sombong jangan so ganteng itu haters balik jadi fans kamu
5268,heyy buat kalian
5269,anggap ajah haters jemboeut muncul
5270,elo cuma ngentot aj
5271,soapking anti bakar pantad ea pepeq terus berkaraya
5272,ericko lim jadi motivator muda wkwkwk
5273,nice ric
5274,bro endk vlog
5275,mantaapp anjingggg agi
5276,anak kontol
5277,bang aku cewe bukan hode babi
5278,sip gan wkwkwkwkwk
5279,guna kamu anjing babi
5280,memang gila haters mu kau ganteng
5281,hello anak slb tidak idiot adalah orang orang yg paling istimewa
5282,ada sesar
5283,chanel familie friendly dunia woowwwwwww emenjink
5284,wik wik wik wik wik wik ih ih ih ah ah ah bau memek
5285,bang kalau semua video mohon bang jangan bahasa kasar bannyak anak udah tau kamu bang g bang mohon bahasa di sopanin mohon bang
5286,hi tll
5287,iklan menit aku skip anjink
5288,lucu memek ngilu
5289,lanjut eksperimen masak masak dong chef nos
5290,haters hanya baik ada video
5291,terus semangat bang
5292,haters
5293,ngentot wkwkwk
5294,semangat bang erick
5295,woi kontol masalah kamu ama atap bagaimana
5296,moba entodlu mana rick
5297,perut apa roti sobek
5298,gua fans arap atao ericko yg penting gua hibur tertawa anjinkkk kontol sumpah seru maju terus rick
5299,bang ericko selalu semangat penting kamu punya rasa baik bang
5300,bang kali bikin konten bayank bacot nya
5301,benci is fucking crazy
5302,bang kasih tau bocor youtube rewind dong bang
5303,jangan pernah rasa jelek rena banyak yg ngebully kamu ciri khas kamu klw kamu ubah kamu bukan ericko p
5304,trigerrnah rasa jelek rena banyak yg ngebully kamu ciri khas kamu klw kamu ubah kamu bukan ericko p
5305,konyol kamu bikin gua betah nonton channel kamu bang wkwkwk jangan terlalu tolol
5306,terus karya bang lim aku mau tanya filthyrick nya mana
5307,ahhhh baumemek
5308,gara gara toxic erik jadi subcriber wkwkwkwkwkwkwk wkwkwkwkwkwkwk wkwkwkwkwkwkwk wkwkwkwkwkwkwk wkwkwkwkwkwkwk wkwkwkwkwkwkwk wkwkwkwkwkwkwk wkwkwkwkwkwkwk wkwkwkwkwkwkwk wkwkwkwkwkwkwk wkwkwkwkwkwkwk wkwkwkwkwkwkwk wkwkwkwkwkwkwk wkwkwkwkwkwkwk wkwkwkwkwkwkwk wkwkwkwkwkwkwk wkwkwkwkwkwkwk wkwkwkwkwkwkwk wkwkwkwkwkwkwk wkwkwkwkwkwkwk wkwkwkwkwkwkwk
5309,tetep semangat aja rick keep charming stay focus and still going at this channel
5310,bangga kamu kena komen hatters
5311,bang ubah sikapnyaa yah chanel nya makin kembang
5312,bang gua udah lewat detik gabisa subscribe tambahin dong waktu menit gitu
5313,i love erickolim
5314,hahah tetap karya aja anjing ush dengar haters
5315,muka lonte aja
5316,kagk usah pikirin bang haters bang karya aja terus bang gua hibur kok
5317,haha mantap
5318,salah pas bikin apa salah pas didik mas
5319,i feel so good when i hear the intro
5320,bantu subscribe dong aku mula aku subsback coment aj lapak aku
5321,erick gua hinaya aku lihat perutlu gemuk kont lmu kecil jujur
5322,aku dapet iklan k ndom sutra njer
5323,aku dulu sedikit benci sama kamu bilang haters tapi aku lama lama suka anjay sama kata kata toxic kamu kata kata hibur
5324,intro lejen v
5325,kamu laki rik
5326,banyak iklan kentod
5327,tetep aku support in bang eriko lim biar bilang apa yg penting tetap semangat buat channel yg lucu abai yg hina jelek an biar dapat karma semangat terus bang lim aku support inkwkwkwk wkwkwkwkwkwkwk wkwkwkwkwkwkwk wkwkwkwkwkwkwk wkwkwkwkwkwkwk wkwkwkwkwkwkwk wkwkwkwkwkwkwk wkwkwkwkwkwkwk wkwkwkwkwkwkwk
5328,sipat asli mungkin seperti kaya youtube semua urang cunya cara masing masing di tonton banyak urang
5329,main growtopia like coomenct
5330,aneuk harem haaa buy aneuk okma bangsat anjing kaaah haaa aseeeeee makkkah fuck
5331,aku paling suka kalau kamu pake intro begitu wakakak
5332,suka
5333,bang ps sekali aku bahas globalisasi
5334,bang like baaaaaaaaaang
5335,buat apa skip iklan ngabisin kuota doang
5336,jadi gin
5337,eric gua suka sama kamu kamu bikin gua ketawa
5338,kalau jahat nama fans bang
5339,kalau subscriber mah bukan haters kali youtube ig follow subscribe dulu biar liat postingan video
5340,bukan haters kalau subscribe
5341,bukan
5342,rikes gaming kamu dahh tobat
5343,kamu punya ig njing ericko lim give away ig bngst
5344,bct anjink kalau suka usah nnton anjink
5345,biasa ego
5346,emng goblok
5347,pansih anjink
5348,memek bacot
5349,memek kamu
5350,tertawa bilang aja kamu mau like erik
5351,bilang aja mau like ericko memek kamu
5352,ajajajajaj katain kontol
5353,makin banyak haters makin bantak nonton dah share biar tambah hate bagus bang biar banyak nonton kwkwkwk
5354,kamu mirip pink guy anjing bangsad
5355,hiyaaaaaaaa
5356,emang kamu ngentot goblok awas tu ss pas kamu meggang memek kamu sendiri viral nnti
5357,lanjut saja bang jangan hirau bocah yg cuma ngebully
5358,botakin kata jt subscribe ken botak
5359,bang
5360,soapers ras atas rapstronout kontol
5361,erick is ganteng
5362,omaiwa mo sindayo cengiiing
5363,banyak yg iri bang nambah duit kamu kalau banyak haters
5364,buat haters anjing kalau suka y jangan nge gas ngentot
5365,biar ja bang engak tau juang kamu bang tetap karya video video kamu bisa buat orang senyum nghina jelek an biar mereka dapat karma semangat terus bang lim aku support inkwkwkwk wkwkwkwkwkwkwk wkwkwkwkwkwkwk wkwkwkwkwkwkwk wkwkwkwkwkwkwk wkwkwkwkwkwkwk wkwkwkwkwkwkwk wkwkwkwkwkwkwk wkwkwkwkwkwkwk
5366,semangat bang bikin konten yg unfaedah justru yg aku suka video video kamu
5367,diss haters rick
5368,intro legend is backnten yg unfaedah justru yg aku suka video video kamu
5369,terus karya kontol
5370,f for erckontol wkwkwkwk
5371,kamu ngomong aja kontal kontol satu video biar bikin ketawa wkwkwkwk
5372,mantapp aku tertawa liatnyal satu video biar bikin ketawa wkwkwkwk
5373,orang mau jadi haters cuma nambahin dosa doang
5374,sayang
5375,ngapain kamu kontol punya id buat lagu coment coment benci jamin virall
5376,ngiri u banyak yutub u jt subscribe
5377,i love this intro
5378,aku suka rik komen komen haters kamu tolol nya beri tuhan langsung
5379,enak erik yg dulu beda kalau skrng gjls cuman toxic gjls
5380,dulu beda kalau skrng gjls cuman toxic gjls
5381,sekarang aku demen coli lihat video video ericko lim
5382,kontol kontol kontol
5383,bang bikin review mobil kamu dong bang
5384,anjing bangsat tai biji kontol bangsat
5385,ikut komen
5386,kapan review mobil kamu bang
5387,haters kok mirip anjik
5388,cinta yakultmu minum usus hari
5389,tidak anjink
5390,bng tepat janji jt subscribe botak
5391,maju terus broo aku ska gaya lue aku suka konten kamu ttep karya
5392,ato aku ngehina kamu aja biar masuk video kamu
5393,anjing kamu rik tertawa gua vvvv
5394,haha kamu rik tertawa gua vvvv
5395,wowowowo erikonolimitpros
5396,kwkwkwkw haters mah gatau asli si erik haters kntl emng
5397,bang aku saranin kamu hapus channel aj wkwkwq nyindir yaa
5398,g aku saranin kamu hapus channel aj wkwkwq nyindir yaa
5399,awas adegan
5400,bang gua mau kasih kata rahasia
5401,intro jess wkwk
5402,aku heran sama haters gilir pihak erikolim aja bilang bocah what nya nyadar kamu aja bisa apa pada semangat terus kaya bang jangan dengerin kata haters
5403,jt subscribe mana kuat tahun
5404,haters anjing kamu kagak pernah sekolah harga karya orang mau kagak kalau kamu haters buat channel harga goblok haters
5405,bukan soapers anjing makanya bacot doang
5406,adsense sangat mantap
5407,hidup kdamng sangat adil
5408,kontool kamu
5409,aku salah satu subcriber setia kamu rik santai aja kalau iklan aku skip gangu baget soal
5410,wkwkwk
5411,aku mau nanya jink
5412,autis kamu yaa
5413,bang gua muslim jdi jangan pake toxic bales jwabah tdi kalau mau antem sini goblok
5414,bgst tertawa gua
5415,mana intro kiamat tod
5416,inti kamu tetap semangat aja buat vidio bg
5417,aku kasih tantang kamu nonton samping ortu kamu volume full apa yg jadi bg lim
5418,meski toxic we suka we toxic h h
5419,memek kok ngilu
5420,kontol jembot
5421,sungguh sayang para haters cuvluk
5422,kalau haters jangan didengerin boleh bikin lagu fatfabs
5423,ericolim aku dukung kakak kakak panutan bangsa cuma chenel kakak yg faedah wkwkwk
5424,konten unfaedah
5425,coba aja w ketemu haters haters nya soapers w sleding dah w baca aja kesel bang ericko
5426,hmmppsshh bau memek
5427,kata botak anjing
5428,erocolim aku dukung kakak kakak panutan bangsa wkwkwk
5429,haters bisa buat kata yg jelas hidup haters yg jelas
5430,kapan acara agama bang
5431,oke sip mulai skrng aku hate erick bsa dibales komennyyg jelas
5432,terus karya bang colim
5433,skuy living rick
5434,bodo bang gwe buka suka sama kamu gua nonton video kamu buat hibur doang inget aja lah bang pohon buah yg lempari batu kayu tai jembut hate ah mana tau baca eric kontol
5435,anti anti baper clubanya suka sama kamu gua nonton video kamu buat hibur doang inget aja lah bang pohon buah yg lempari batu kayu tai jembut hate ah mana tau baca eric kontol
5436,haters nya kok komen
5437,wik wik wik wik wikwik wik
5438,belakang erickolim lemari belah kiri golden play button bukan
5439,ayok gera ubsubs erikolim bulan
5440,paling mustahil channel adalah
5441,sukses terus ericko limm banyak subscriber
5442,sabar bang nama hidup orang suka yaudah kita punya hak masing buat hidup semangat bang jangan picu sama haters
5443,woi heaters bisa kok koment temu aja erik kalok berani jancok kontol heaters kntl jembut
5444,tetap semangat selalu support kakak keren ontol heaters kntl jembut
5445,kamu ganteng kalau lebih kurus bang
5446,aku suka banget ama orang ini
5447,suka banget ama orang ini
5448,langsung mencet tombol like gwe bngst
5449,teguh suganda kok ngegas
5450,satria gaming g
5451,ortu kamu ngerti anjing memek kontol
5452,ortu ngerti bahasa apa lol
5453,udah biasa ae
5454,nan
5455,silver
5456,golden ama silvier
5457,silver play button
5458,nga yg nanya nga yg duli
5459,anggita rumah mu mana ketemu a cok
5460,nemu bocah kontoll
5461,brati si erico lim temu juta heaters dong situ sehat
5462,heaters panas
5463,cyper bagaimana nemuinny
5464,woy haters gapunya otak erik bilang ganteng hebat keran sogaya buat senaginlu konten kalau gasuka konten erik gausa subscribe lah haters kontol gapuya otak kamu hina orang dirilo gabisa apapa kamu gejek erik dia sukses kamu hetes ejek dong faedah hiduplu gaada heter tolol subscribe erik juta dandia sukses atur dirilu dululah baru ejek orang dirilo aja beras gejek hina orang bodoh benci tolol
5465,gpp bang lupain haters aj liat subscriber kamu brp
5466,undang artis jav ytri ric
5467,bang toblatlah indonesia coli
5468,mukalu kontol belah
5469,terimakasih bang udah ngehibur
5470,erick kontol lim anjing kaya baby muka pas pas banga dasar taikkk miliar pake kontol elo kecil sok soan ganteng taekkjkkkkkk kampung banget
5471,komen ny bnyakan benci elu awoaowkaow mles scroll sihh
5472,woi kamu erikontolim ngapa kamu ngajak undang gua yotube rewind padahal subscriber gua banyak kamu liat aja sendiri noh cek brp subscriber gua
5473,woi erick kontol lim ngentodskidipapap tau kamu gara gara kamu temen aku jadi g bener tau konten konten kamu kata chanel agama didik kenapa ngomongnya anji asw kntl dasar erick kontol lim bngst jilat memek maklo aja sana
5474,apa cuma aku subscribe eriko murni hati nurani
5475,bang aku laper
5476,macam kontol belagu tll sini sama aku aj
5477,nice rik terus toxic mu rik
5478,anjing kau haters ericko abang w taikkchannel didik
5479,i like you erick kontol wkwkwk
5480,you tube rewind
5481,tonton
5482,kok you tuber lama di undang
5483,haters yg bacot gua yg kaya
5484,ericko lim ngemis subscribe
5485,baca coment gua bangsat ngehibur pake kata kotor diajarin kamu sama emak kamu emak kamu gamarah kamu ngomong gituan gapernah sekolah tidak ajarin ya
5486,rik kata emak gua kamu dulu kecidyduk lgi coli wc skolah yah
5487,bang erick juta subscribe cukur semua jembut kamu yg tuju diajarin kamu sama emak kamu emak kamu gamarah kamu ngomong gituan gapernah sekolah tidak ajarin
5488,kok aku tertawa gitu btw tuju bang banyak haters banyak duit
5489,gua notnon iklan skip anjeng yg skip cupu bangsat
5490,bang kalau memek bau
5491,gausah denger kata bg aku aja liat komentar yg gasuka am kamu aja jijik bangets
5492,channel faedah
5493,iklan aku skip rick
5494,eh anjing mending kamu hapus channel dasar kotor manusia beban bumi kamu kontol ericko lim bangsat
5495,konten kamu mutu semua ko rick
5496,tempik
5497,rick kalau kamu biasa ngomong kontol coba lihatin kontolu wkwk
5498,udah subscribe icko
5499,tertawa njing gblk ngomong kontol coba lihatin kontolu wkwk
5500,hatrezzzzz kontollll
5501,bukan mau bela soapermah gtu penting buat debat ama haters kaya kontolmah ada waktu mending urus diri sendiri ngurusin orang tidak tidak punya otak tolol dna
5502,mantap mau bela soapermah gtu penting buat debat ama haters kaya kontolmah ada waktu mending urus diri sendiri ngurusin orang tidak tidak punya otak tolol dna
5503,kok jago cewek kamu main ml ajg kontol bangsat malu dh
5504,muke kamu makin kucel aja jarang mandi ni bcah
5505,panutan gua anjerrrrr wkwkwk toxic kamu gua tunggu
5506,anak anjing
5507,menit sedang tonton video dengan saya pause lama menit makan qtela guud mhankk
5508,sikap kamu bang patut contoh
5509,ngekek ajgharus patut contoh
5510,nyuruh erick didik sama aja nyuruh website vokep didik
5511,haters minum susukntlmanis aja kamu
5512,gua suka kamu bang gua suka orange justice kamu
5513,no toxic no lifeua suka orange justice kamu
5514,kumpul sama ci rina rik
5515,bebas karya inovasi
5516,si kontol anjingg ngentot
5517,rik aku mau kamu bikin video riview tt nya odi ong kafilah lalu lah bag
5518,haters anjg
5519,kapan kamu makan jembut anjenkkkkkkkk
5520,semua iklan gua skip bang biar beli mobil
5521,ericko lim oppa no limit pros souw liong liow gamerz gaming
5522,keren lah ericolimo limit pros souw liong liow gamerz gaming
5523,kamu kagak botak gua jadi haters
5524,gua selalu support kamu ko bang santai hatters hatters kontol emang
5525,kirim iphone k gua dong
5526,ngentot lah
5527,erikontol muka kontol tai babi bocah anjing anak haram bapak ngentod sama lonte murah haha wkwk
5528,coment coment nya orang orang tololl sirik sama sukses kamu bang ericko lim haha dasar anak tololl kontol anjing semua coment nya gituh
5529,yg tau backsound ericko judul apa
5530,woyy erikontolim anjinkkk muka kamu kontol muka gua lebih kontol kamu nyadar kalau kamu kontol sama gua seperti kontol gua nge hate kamu pngen msuk yutub kamu anjinkkkkk
5531,aku slalu nonton video anjg kami dsini bukan haters kamu kntl channel keluarga yg family friendly super anjing keren panjang masa
5532,bangsad ni channel pler iklan video tolol babi kontol
5533,ngakakkkkkkknnel pler iklan video tolol babi kontol
5534,hey
5535,mantap kali
5536,bang knpa ganti nama chanel jadi erickontolim
5537,bikin ketawa kamu bang erick l jadi erickontolim
5538,konto olive sip
5539,kok akhir nya ceramah
5540,go go go go subscribe juta subscriber tahun inil
5541,semangat bang aku subscribe kamu k semua konten kamu manfaat aku
5542,live nyabun lah rik
5543,cetak haters banyak nya bang biar auto kaya just hibur yg liat pasti punya otak dipake lah
5544,komennya goblok banget dah biar auto kaya just hibur yg liat pasti punya otak dipake lah
5545,bang muka kamu ganteng
5546,yg ngehate pake real akun keren wkwk berani nya pake fake akun wkwk btw kok haters tolol erick upload video buru klik cuma buat dislike btw iklan kok dikit rick cuma aku skip
5547,kontolim
5548,banyakin toxicnya kentot
5549,anjink ending nya dilamain biar adsens ngalir ber banyak kalau lebih toxic kamu
5550,opening comeback
5551,haters otak kontol hahahah
5552,kok inter masa masa hidup sangat adil
5553,bang minggu toxic cobak bang
5554,i like your opinion cobak bang
5555,banyak haters banyak uang
5556,mantaap anji k
5557,btw video kamu gua download buat bacol hehe
5558,keradeo kamu gua download buat bacol hehe
5559,jangan anggap lah bang haters kontol
5560,semua iklan gua skip bangsat
5561,kontoruuuuu
5562,kamu mau hate komen gua kasihtau gua kalau liat video kamu gapernah skip iklan bahkan iklan muncul udah gua skip mamam noh haha klan kok dikit rick cuma aku skip
5563,lighting kamu kurang terang bang besok cari tempat yg cerah yak
5564,pantat tipid hqd h
5565,lagu laguu
5566,haters kamu tau nama anti vlog bang wkakakakaka
5567,hidup haters
5568,buat haters liat anjeng yg like lebih banyak pda yg dislike kontol
5569,intro legend lagi
5570,hmm bang ericko lim sabar ajh d
5571,toxic bego jangan anjenggg
5572,jangan maksa
5573,anjing kamu goblok gua suka video kamu jadi aku subscribe
5574,subscribe chaneel aku yak saling dukung
5575,wkwkwkwkwkw keren bang aku suka ama kamu
5576,siap aku nonton langsung iklan no skip aku langsung vid wkwj
5577,emang kamu jelek jangan sok ganteng
5578,bang gua mau jdi murid didik kamu njing
5579,haters mna suara nya wkwkwkwkwkwwkwkwkwkwk
5580,tertawa anjenkkk
5581,mungkin iri kali bang banyak bacot bisa karya haters kontol muka memek keluarga nya anjing
5582,semangat aja bang jangan serah ajinkkk tidak canda banggg
5583,heran gua ama haters kamu rick suka di tonton terus bnykan like pda dislike nya tampang kamu begini gua demen ua skip mamam noh haha klan kok dikit rick cuma aku skip
5584,rick botakin pala kamu dong biar makin keren si justin bentuk kontol rambut heheheheh begini gua demen ua skip mamam noh haha klan kok dikit rick cuma aku skip
5585,ternyataa haters haterss kamu goblok yaa rikk banyak minum kiranti hahaah
5586,support anak kontolrss kamu goblok yaa rikk banyak minum kiranti hahaah
5587,haha tu hatters iri sama kamu ken femes aja todd kntl emng
5588,semua komentar haters jawab cerdas mantap aku suport kamu tol rambut heheheheh begini gua demen ua skip mamam noh haha klan kok dikit rick cuma aku skip
5589,yg aku demen vidio adalah kata toxicnya
5590,kontoll kamu bang anj ng
5591,kamu pernah nyium bau meme lim wkwkwkw tertawa anjinkkkk
5592,terus semangat ericko lim lupain aja haters
5593,haters memek cuma bilang comen kontol berani langsung orang nya
5594,chainel yg paling friendly banget dah pokok aku orang nya
5595,gua suka gaya kamu rick wkwkw ngetod
5596,intro yg gua tunggu
5597,video dpt simpul orang sikap waras lebih bahagia yang sikap waras
5598,woi erick kontol kapan kamu potong botak ajg dah juta lebih kontol tuju like and comment
5599,goblok kamu bang ngapain kamu nge youtube guna tau motivasi nihng tuju like and comment
5600,skak matt sight i wrong number oooowbwhwowowowowbwhwhwhwhwoowowowoehwhwhhw
5601,kafir angkat tangan
5602,jdi aku hrs jdi soper haters biar guna hwhwhwoowowowoehwhwhhw
5603,ko erick kalau haters benci ama kamu mereka nonton videolu
5604,haters kamu cam kontol anying banyak nonton bok p
5605,erick ganteng aku cowo
5606,halo kpai
5607,semangat bang ericko
5608,sumpah like comment
5609,kapan bikin tutorial colj dong rik
5610,bang aku suka ama cewek lama kamu
5611,hatesr banyak makan micin kali wkwkw
5612,weee intro erickolim no limit pros yg dlu lgi jdi nostalgia
5613,pas sad moment aku ngerasa kamu motivator wkkwkwkwkwkwkwk
5614,kagak aku skip iklan adsense kamu
5615,koment vid eric haters nya yg good
5616,tertawa anjink benci gadungan ngomen aje seperti gitu ken jdi benci wkwkwk u lebih baik jual dh hp u tong mata w perih liat komentar u anjink
5617,kalau ngomong kasar sensor donk
5618,first
5619,akhir intro di tunggu tunggu
5620,maksa minta like sama subscribe kocak ente
5621,intro dewa is comeback
5622,meme sz kontol
5623,buat heaters
5624,maaf kalau kasar
5625,moga makin banyak haters kamu bang auto kaya
5626,ngomong jorok nya kirangin om wqwqwq
5627,intro nya keren
5628,tumben kamu pinter erickolim
5629,orang yg nda suka video goblok nda suka tetap nonton dasar orang kontol
5630,cewee kamu mna ajgg ko rik mungkin pcar online ajgg apa nda ada yg mau suka sma loo
5631,bikin konten bacain komentar positif yg di video kamu
5632,it s flithy rick mother fucker
5633,ngentot bareng aja cok
5634,kamu kalau mati aja erik biar aku chanel didik kamu kalau kamu ngasih waris chanel kamu aku biar aku cepet kaya
5635,haters komennya baca sama eriko lim auto kaget cengang wkwkwkwkkw
5636,aku tetap dukung kamu bang erico lim aku suka kalau kamu toxic tingkat walaupun haters banyak ngak usah pedulih
5637,ken nyobain titid kamu rick
5638,percuma comment jelek ericolim tidak ubah hidup dan neng ngelakuinnya jadi lebih baik support biar bisa lebih baik tentu yg comment jelek ericko lebih mapan dia
5639,enkaneka
5640,erikomoba nikahin aku dong i love your life stile and your kon l neng ngelakuinnya jadi lebih baik support biar bisa lebih baik tentu yg comment jelek ericko lebih mapan dia
5641,kata dylen erico baik dya toxic cuma kamera cuma buat hibur kalian
5642,heatrs orang orang goblog
5643,rangin kata jorok nya aja bg
5644,ehk ericmemek gwa dukung kamu truss tod
5645,kamu banyak bacot
5646,habis konten bang biar biaya youtube rewind
5647,tolol kali kamu semua rugi kamu bully si eric emang tingkah nya kaya gitu lah yang neng
5648,follback bangemua rugi kamu bully si eric emang tingkah nya kaya gitu lah yang neng
5649,haters haha udah biasa para youtuber
5650,kata siapa eric subsnya beli eric usaha goblok kamu cuma ngomongin orang eric banyak subscribe karena soapking dukung ericolim
5651,dear mr ro
5652,coba kalian pause si eric search youtube makan jembut wkwkwkw btw jemb t nya eric lebat
5653,iklan gua kaga skip bang
5654,haters erick banyak erick dpt lamborghini
5655,kntl kental
5656,aku chane cuman buat pause dislike comen hate
5657,erick abang kamu apa tuhan kamu
5658,migdal makanuay matiin notifnya kontol
5659,deidora the exploder haha subscribe baru harap maklum gan
5660,danang gaming liat aja ee yang ngetik dikomenannya makanya jangan tinggal nonton ada kuota
5661,kapan babi comennan orang babi kalau jt subscribe botak
5662,emang janji
5663,lah apa hak kamu ngetik gin tolol semua orang punya hak pilih apa dia ingin tod
5664,besok besok ericko lim jadi motivator rang punya hak pilih apa dia ingin tod
5665,byun baekhyun kamu nulis kagak bener
5666,cfuz channel aku bukaaaan haters okener
5667,cfuz channel kamu nanyaaa apaaan
5668,heaters
5669,kamu ganteng kamu gendut kamu gendut mesti tambah gantenglih apa dia ingin tod
5670,bang ush ngurusin haters goblok yg penting karya terus
5671,main cepet asw
5672,puja jembut eriko ulululululul
5673,youtubers konten faedah duniaa
5674,fuck haters
5675,bang i love youu
5676,anak haram kontol memek kontol
5677,bodo kan aku ketawa
5678,wkwk banyak cebonk
