,ID_Comments
2683,tampang kamu kaya kontol tapi gua suka ama kamu rik
2684,jangan dengerin rick kamu ituu hebat dahhh maju terusssssssss yaaaaaa
2685,mirip konten erpan
2686,gua sebenernya suka sama kamu bang sering nge toxic
2687,sexi kamu lim toker kamu ada
2688,kata beli kok likernya banyak
2689,haters haters memek kamu kencing aja lurus tolol
2690,yt anjing kamu bang dasr abng mei kontol
2691,aku ngikutin kamu lama konten konten kamu hilang stres aku tysm
2692,dasar haters haters kontol bilang mati aja kamu kamu aja sono dasar bch bch kontol entot memek anak haram
2693,gua orang perlu didik gua dapet ajar didik nonton ericko lim vidio nya didik banget anjir gua suka banget vidio kaya gin
2694,tuju jt giveway bang
2695,fans
2696,tertawa bangsadddd
2697,tertawa bangsaddddd
2698,hatersnya rata rata si astronot roket
2699,sabar lim and fuck you
2700,biarngpa kamu pngen tenar ngehujat artis laen njs tenar kaya gin ekek
2701,gila cuma chenel yg santai sama haters malah bangga in lha yg sampai buat ngerap soal haters anjing
2702,semangat bang aku selalu dukung
2703,mangat bang aku selalu dukung
2704,bang erick ngelakuin semua konyol dia punya malu gais beda sama yaudah jadi nikmat aja mayan buat bahan colmek ceue ceue
2705,kata siapa ada bain ericko lim aku bain njink
2706,arap goblok
2707,bicara kasar hibur
2708,entah aku paling suka ama channel hilang stress bikin tertawa
2709,pliss hatersnya ericko lim henti nge hate memang salah ericko lim apa sampe nge hate kaya gitu
2710,waduh berani berani majang muka presiden aku
2711,bang haters kamu kok goblok semua apalagi yg byk duit byk haters mending hapus cenel tertawa
2712,mantab bang maju terus
2713,mohon sabar tahan emosi
2714,benar masalah bagaimana bagaimana elu yng penting hibur laku elu emng aneh itu yng bikin hibur tetap diri kamu bang semangat
2715,bang gara gara kamu teman aku dulu toxic sekarang banyan toxic
2716,aku support kamu terus rik
2717,lim hahah keren bang
2718,collab sama qorygore coba haha
2719,memang anak nakal sering kali ngomong kasar masih batas wajar
2720,semangat kak ericko lim
2721,intro old ajg
2722,hina tetap santuuuyyy wkwkwk
2723,bang buat lebel samping video kamu r bo remaja bimbing orang tua biar anak anak nonton biar lucu aja hahahaha
2724,chanel hilang stress yg perna gua nontonin bahkan amper smua bang vidio kamu gua tontonk nonton biar lucu aja hahahaha
2725,mantap coment for money
2726,buat haters kalau suka biasa aja usah jelek in coba kalok aib kamu sebar in mau apa tiap org beda buat erickolim buat vidio yg agk didik tidak pihak siapa maaf apbila buat kalian sakit hatiiu walaupun kamu sering nge toxic sisi elu begitu di depan kamera doang di balik kamera kamu baik banget nyata
2727,lanjut tetep karir kamu bangka biasa aja usah jelek in coba kalok aib kamu sebar in mau apa tiap org beda buat erickolim buat vidio yg agk didik tidak pihak siapa maaf apbila buat kalian sakit hatiiu walaupun kamu sering nge toxic sisi elu begitu di depan kamera doang di balik kamera kamu baik banget nyata
2728,channel hilang stres
2729,the best lah buat kamu bang
2730,wkwkw tertawa anjir
2731,tempeekk
2732,terusin bang suka sah nonton gampang suka ikut komen uang bang eric nambah lah
2733,asli ko tertawa sndiri yh nonton gampang suka ikut komen uang bang eric nambah lah
2734,terus gua peduli apa faedah upload video gajelas
2735,bang gua kangen kamu main pb lgi
2736,sumber benci jadi benci orang benci
2737,bang chanel lhu ganti jha jangan ericko lim erick kontol
2738,bang knp youtuber ngomong jangan lupa subribe kalau lupa napa
2739,mantav mamankyoutuber ngomong jangan lupa subribe kalau lupa napa
2740,goblok kamu
2741,daniel halim goblokk
2742,ericko asli nya
2743,hidup ericko
2744,wkwkwkwk salam soapers
2745,yowww yowww broowww broowwww
2746,influence creator
2747,bro brooo
2748,bro gore
2749,aku nonton nya
2750,true
2751,editanya pros
2752,itanya pros
2753,febri dwi laksono kaori aja noh idh mati cari kubur sagiri udah perawan sudah kupake
2754,sagiri aja deh masih hidup
2755,febri dwi laksono sagiri or kaori
2756,puti nadhira azali a waifuku kok ngomong kasar kubur sagiri udah perawan sudah kupake
2757,takuto harsakusumah kanehira wkwkwk usaha bro
2758,gaming thnks
2759,baru satu hahahahaha
2760,nan
2761,akwoakwoakaoakakk terbaikkk bangsattttt tertawa
2762,gua peduli haters kok bikin lagu
2763,bang buat internet personality
2764,q a with kontoru
2765,why almost people hurt to other
2766,haters comment ngehina pas ketemu langsung minta foto lol
2767,ayo rame rame unsubcribe chanel
2768,untung aku lahir caesar
2769,sekali kali kalau kamu buat content tidak ngomongnya jangan toxic kalau ngomong toxic kamu bayar denda rb terus kamu sumbangin orang butuh
2770,tetap coli kontol perih
2771,unfaefah kok suka lakuin pandai nya silat lidah bro emg jago kamu balik fakta yar denda rb terus kamu sumbangin orang butuh
2772,njir intro nya
2773,anjing aku paling benci kalau nonton kamu gaada iklan
2774,kamu gantenggg
2775,bang toxic bacot ome tv dong bang yg stuju like
2776,fans from malaysiat ome tv dong bang yg stuju like
2777,buat hatters unsub ngehina ttep aja nontonin video orng ni malu apa kamu
2778,rick tenang aku bukan hatters kamu kok
2779,youtube buat entertaining anjing kalau mau didik ikut les bimbel bangsat goblok yah
2780,channel kamu bng bagus hilangin stress
2781,walaupun yg suka tetep subscribe
2782,erick mirip main bola adam alis bhayangkara fc
2783,njir uting
2784,binasa haters
2785,heran ama yg comment buruk ngapain nonton kalau suka
2786,hetters kamu banyak kaum pantad tipid mudah bakar pantad nya upgrade dulu makanya kalau mau nonton
2787,i love toxic
2788,cenel bikin gua hibur ad tipid mudah bakar pantad nya upgrade dulu makanya kalau mau nonton
2789,erickontolik muka kamu jembut jadi kaca anjing dasar goblok
2790,kasi gws
2791,bang matiin ads cent kamu
2792,aku kangen intro erick yg dulu akhir pake good lah
2793,kapan maen pb
2794,ngegas
2795,aku subscribe permanen bang channel didik hehehe
2796,gooooo soapers
2797,bener kamu rik jangan denger in tu heatres ajing kontol
2798,dasar haters otak tai babi
2799,bangg mohon bca
2800,eh erikontol duit njinx
2801,tertawa so hard pepek ampe ngilu hahahahaha
2802,bang konten makan jembut bang please
2803,ada yg nyuruh kamu nonton ajg kalau emang didik gausah nonton dasar haters gblk erick obat buat ngilangin stres tertawa liat muka konyol si erick
2804,ini bunda efek daki selangkang suruh bikin channel youtube
2805,bct kamu kontol dasar orang anjing jujur aku suka lagu lagu hina orng konttooolllll babi
2806,aku sukaaa sama konten luuuuu hibur mau kamu toxic laku yg unfaeda hibur bangt kamu tampil beda luar negeri banyak kok yg buat konten unfaeda kamu satu nya orng indo yg beda hahaha but i like that
2807,senyumin aja bang rick fans berat kamu
2808,dasar sampah kamu erick kontol
2809,woy kintol memax injang bangsit jav hd porn masukin aku
2810,aku tetep dukung kamu ther jangan dengerin omngan yg enakin mungkin begitu dia cuma tau video sifat kamu smbng petakilan bgtu dia gatau hari kamu hati kamu kaya gmna jadi no komen bang
2811,tau rasa dibuly makanya jg buli orang anjink
2812,ngangkang eh tertawa wkwkwkwk
2813,good morning
2814,satu kalimat
2815,aku channel bikin mood coli aku gairah
2816,kalau suka syukur kalau ya gapapa sesimple anjing
2817,kamu jelek kntlllll
2818,kalau gasuka usah nonton kentodd hatters gblk
2819,loveyouuuuuuuuu bang kontol
2820,part kontol
2821,s i g o b l o k
2822,bangsat chanel gila anjing naik terus ban toxic kamu gkin begitu dia cuma tau video sifat kamu smbng petakilan bgtu dia gatau hari kamu hati kamu kaya gmna jadi no komen bang
2823,lucu
2824,tertawa sumpah nntn nya anjing
2825,gin ni kalau lahir lubang pantat bukan lubang memek
2826,wkwkwk gilaaaa kami sukaaa channel pendidikann
2827,iklan aku skipp bngst cuma buat nambahin kamu buat yt rewind
2828,kenal gara ngomong bangsat sama anjing hahaha lyric nya cocok buat kamu ericko fucking lemu video sifat kamu smbng petakilan bgtu dia gatau hari kamu hati kamu kaya gmna jadi no komen bang
2829,gua tuju anjink
2830,edit video ne bagus anak esdeh ngedit tiktok
2831,intro bacot nya mana anak esdeh ngedit tiktok
2832,ngomong apa kamu om
2833,udah ciri khas erick
2834,bang kalau dah jt donasiin
2835,tertawa anying
2836,bangke kamu
2837,gua lebih suka kamu yg kya gitu bang diemin aja kata haters mah emang haters kontol idiot sampah
2838,bang yutub jangan lah kata kasar kalau anak keci liat marah ibu kamu anjing erikontol jelas anjjing pegang pegang pentil njing emang ada otak ngapain buat chanell ada manfaat
2839,bang kapan kentot sama kimmy him him
2840,gpp bang yg pnting jangan sampe bawa ras suku agama takut yg di ingin jadi
2841,slowo wolow solowp poloso
2842,bacaa bang erikontol
2843,wkwk kalau baik bukan haters kali wkwk u agama takut yg di ingin jadi
2844,justru orang bangke kaya gin lestari kembang biak di lindung
2845,rambut keramas brapa abad
2846,patner depan jahat hati nya baik tolong anak yatim piatu pokok the best rick cheers ang wkwk
2847,genjutsu
2848,sans rik aku terinpirasi banget abis nonton vidio kamu im piatu pokok the best rick cheers ang wkwk
2849,kontol ngentod gua tertawa lebih toxic lgi dong
2850,tertawa bet
2851,kok qorygore kan presiden gua
2852,channel anjing ad faedah nya sama sekali entah knp aku sabskrep
2853,haters goblok kontol mikir lah bro eric mana mungkin beli subsciber mikir lah itu udah kenal kali dasar goblok kocak haters anjg yg lebih extrim dong
2854,kalau kamu direndahin usaha tinggi taik
2855,gua nontonin biar kamu dapet duit buat urus youtube rewind yak bang pokok bikin yg bener semangat buat bang erik teammmmmm yoyoyo
2856,baca anak anjing
2857,haters adsense dollar
2858,azam kazama kalau ndk suka komen aku jangan bca mati jak sna
2859,azam kazama yg salah
2860,yutup ada filter yaaaa kalau mau liat yg faedah jangan liat sini sama komen sini ada porsi sendiri sendiri
2861,woi kontol
2862,wkwkwk saveg
2863,nyata gada yg tiru alau mau liat yg faedah jangan liat sini sama komen sini ada porsi sendiri sendiri
2864,ngarep
2865,ngarep banget kontol
2866,baca jeng
2867,bukan dollar rupiah
2868,ian achmaddi iya betil kamu bijaksanal
2869,sih kalian ngejek ericko ericko engga bunuh kalian tampar kalian ejek kalian besar besar coba pikir kalau kalian kaya gitu sedih kaya ericko ku lihat pas akhir mau sedih
2870,rafi irwansyah bocah menkreppppp
2871,mantap mamang
2872,jadi gin tiap channel punya tonton nya masing masing
2873,erick kontol limit
2874,aku tantang kamu colab sama rando berani
2875,mungkin orang normal kalau tegur auto mikir kalau orang tegur auto balik fakta
2876,haters normal kalau tegur auto mikir kalau orang tegur auto balik fakta
2877,benci bos baca komen fake
2878,asal muasal haters iblis
2879,hatters otak gada
2880,low quality content and
2881,gasuka kok tonton haha emang bener bang haters fans yg tunda
2882,opening legend is back wkwkkw
2883,benar channel sangat didik gua
2884,guy
2885,gitu anjing wkwk chanel kontol majuterusrik
2886,bang main getting over it dong
2887,hatters pokok kudu nonton anjing
2888,dwp avaan bang
2889,iya bang kamu ganteng onton anjing
2890,anjiingg aku fans berat ama kamu bg eric moga lancar terus y ganbatte
2891,kangen sekali dah ama intro ini c moga lancar terus y ganbatte
2892,erick kontol lim alay kamu ajig
2893,muka kamu jelek anjinx mana sini pacar kamu oe eue
2894,sumpah kamu doang yg bikin gua ketawa tertawa anjirrr bikin video yg banyak bang
2895,hmmmmm buat bang erik terus lah karya karena masa muda buat karya cari pengahasilan sendiri jangan dengerin kata si cebong
2896,tertawa ajg sering gitu tod
2897,si anjeng aku suka gaya kamu erik
2898,haters goblok kamu kalau ngomong masuk akal anjink dilajarin apa sma orang tua kamu aku baca masuk akal tidak ada guna
2899,openingnya beda ajg
2900,mem k ngilu yalord ngakakk wkkek
2901,bang bli subscribe v
2902,bau memek
2903,wkwk mantap rik sini bisa liat mana viewer bodoh sama cerdas
2904,panutan yours my capten
2905,yg nonton ni video
2906,eh ericontole kata bapa gua kaga ngmng jorok ajggg
2907,gua sayang kamu bang soapkingaga ngmng jorok ajggg
2908,bacot anjing ewe ibu kamu acara yutub kamu anjing
2909,sunat duls baru gans
2910,rik tau joji the real of pink guy
2911,kamu keren rick mantap
2912,ngomen negative doang bikin vidio gtu bisa ush komen harus
2913,bodo gua ngak ngurus
2914,kalau banding arap ganteng kamu rik
2915,ericko duet sama bowo tuju like kowko
2916,penting kocak
2917,nama aja benci wkwk
2918,tertawa kontol
2919,bang buat konten ngentot donk
2920,nge pansos
2921,ngehate
2922,chennel sampah baik hapus aja chennel kamu
2923,anti skip skip club
2924,tunggu part nya bg ericko lim semangat bang
2925,kalau jhat seru khntl nnti neraka sepi
2926,hai sayang aku syang ody dehh
2927,dislike
2928,plis kamu yg ngehate kaga pernah liat channel yt kaya how to basic apa yak wkwk kalau kaga suka kaga usah tonton kamu yg pilih terus apa guna bapak mak kamu didik kamu konten kaga selalu didik hibur emg sinetron yg tiap hari kamu tonton didik njink
2929,draw my life donk bang
2930,chanell hilang stresss
2931,haters mah ada kerja makanya sirik
2932,bang aku support abang ada iklan aku nonton sampe abis
2933,kata kak erico lim harus ngomong anjing bgst memek jembut tai kontol bener kak
2934,haters kamu otak tengah ngomong anjing bgst memek jembut tai kontol bener kak
2935,love u ericko lim salam fans malaysia tak kesah apa haters kata u are my heroo
2936,aa sayang
2937,hey haters kamu koment vidio org terus koment nya pgn jadi tambah baik kamu sendiri koment nya ngegas negatif apa mau kamu gblok haters
2938,itu channel unik o org terus koment nya pgn jadi tambah baik kamu sendiri koment nya ngegas negatif apa mau kamu gblok haters
2939,akua ganteng
2940,nenek tuju kamu cucu paling tampan
2941,tdnya nge bully kok sekarang ngebela
2942,sabar aja bang serah mau caci maki kamu itu jadi motivasi erick bersabargas negatif apa mau kamu gblok haters
2943,bau memek erserah mau caci maki kamu itu jadi motivasi erick bersabargas negatif apa mau kamu gblok haters
2944,bagus bagus tolol nya maju
2945,aku lebih suka kamu yg dulu kamu yg youtuber gaming
2946,aku ikut ngehate ah masuk you tube
2947,kata kamu banyak herters malah bikin kaya wkwkwkkwkwkw erickontolim
2948,sabar kak tuhan beri kamu jalan keluar
2949,tertawa aku liat ni video bang terus karya
2950,bait si laurentius randog dong
2951,kalau banyak suka ericko lim ngapain lihat chanel nya tidak usah lihat chanelnya
2952,w suka gaya kamu bg i love soapking
2953,ush dipikirin omong hatersya yg nyakitin hati tu bang yg penting toxic kamu ilihat chanelnya
2954,konyol hibur sukses terus bang erik
2955,jadi kalian tobat lah haters tambat
2956,korban rasa sangat malu tak mampu bela diri hanya diam menang bahkan jumlah kasus bunuh diri frustasi
2957,makanya kalau hamil jangan entot ros tar kepala kena kontol jadi lah anak tolol
2958,nonton aja susah coba
2959,bacot kamu
2960,chenel hibur hilang stres mobangentot lucu
2961,knp aku subscribe kamu bang ngomong kamu kamera emng gin aku denger kopex kamu baik bet orang nya
2962,haters tau entertein
2963,aku suka kata kata akhir maera emng gin aku denger kopex kamu baik bet orang nya
2964,channel paling gila paling aneh paling lucu paling guna paling ngawur i kopex kamu baik bet orang nya
2965,bocil
2966,channel cuman nonton ama komen doang hhhhhhh
2967,sens gaming udah tau kata kotor
2968,erlangga saputra kemarin
2969,kapan kamu mati nek
2970,wow kamu laku wkwkwk
2971,nenek cucu nek
2972,oya bang inget aja buka gua nasehatin cuma ngasi tau
2973,bang gua nntonnya iklan mlu bngst wkwkw
2974,ric kamu takut ngomong kontol mulu entar tu jidat tumbuh kontol baru tau rasa kamu terus tu jidad belah jadi pepek
2975,hahahahahah malah ketawaol mulu entar tu jidat tumbuh kontol baru tau rasa kamu terus tu jidad belah jadi pepek
2976,like tuju erickolim jomblo
2977,bang kamu ganteng tidak sexy entar tu jidat tumbuh kontol baru tau rasa kamu terus tu jidad belah jadi pepek
2978,benar ane haters kagak komen takut bacotin saya unsub terlalu toxic bahasa terlalu kasar saya sering nonton video ente subscribe
2979,aku pura pura ngehate yak erikontol kamu bacot memek kamu udah perjaka
2980,yg bikin video yg punya chanel kok kalian marah si
2981,aku nonton kok iklan bola
2982,ericko aku toxic haha
2983,sopam dikit lucu lah hahaha yg buat masker dong
2984,aku suka banget konyol nya gitu
2985,apa cuma gua mikir kalau ni youtuber youtuber paling tau diri
2986,orang orang ngehate bang ericko lim goblok ke jiwa
2987,channel sayang obat stres moga makin sukses bang
2988,anjing retard
2989,gua sama erick
2990,terus karya bang ericko ganteng suport abang ericko
2991,punya channel ikut suka dia mau bagaimana yg penting hibur pas stress
2992,yg hate kamu iq nya atas rik h mau bagaimana yg penting hibur pas stress
2993,si kontol eling nya kamu bagus gitu kontol fuck bichs stress
2994,tertawa bngsd
2995,terusbekaryabgjangandengerinkatahaterskontol
2996,yeh ads ganggu cok but aprove lah aku buat kamu hehe lord toxic is back btw yang komen pertama itumah anak vexana
2997,ambil hikmah stiap orang punya tuju isi vidionya orang trtentu yg ngerti
2998,hhmmmm video kita ajar nyata komen nyucub eri coli me hate comen
2999,haters fans tunda
3000,we komen harap kasi roti isi jembot
3001,wkwkwk sabar bang lucu
3002,untung pantat kamu tebel bang
3003,anti skip skip cuk
3004,suka aja konten nya bang eriko lim konten sangat hibur aku
3005,bahasa nya kaya qorygore
3006,erick gua fans kamu wkwkwkwk
3007,gua udah subscribe terus suruh subscribe
3008,mantul kak lim w support kamu bang konten sangat mutu ku hibur bet kak wkwkwk coba buat konten buat pisang nugget donat indomie keren kak lim ekekwk
3009,aku suka channel kamu bang kamu bikin aku hilang stress doank kerna channel kamu bagi aku hibur iya udah semua channel ada haters doank jdi sabar aja bang btw keep it up bang erick
3010,demen yang hate comment tolol murni beri tuhan wkwk this channel bring us happiness right btw if this channel give us negative thing we can decline it right just for fun
3011,gua mau masuk yutub anjg kamu
3012,oiii eriko haters kamu banyak bocah
3013,i love you erickolim channel hilang stress
3014,ayo unsuscribe
3015,nyet bikin give away mobil dong
3016,gua kangen intro alan suryajana
3017,ericomenntro alan suryajana
3018,cukup tolol cukup wkwkwk
3019,hatersnya bocah semua anjeng
3020,perut apa celengan babi bangsat
3021,wik wik wik wik wik wik wik
3022,gua selalu support kamu kok lim kenal nama gua ivan novikov gua gedung putih
3023,sabar bang erick
3024,udah pada pusing mikrin haters yuk colay bareng kuy aku punya hentai banyak tinggal pilih loli
3025,channel agama paling family friendly duniaaaa
3026,gin aja dah kamu mikir lah ngomong kasar kamu rasa rugi apa rugi kamu itu buat kamu derita sangatttt yaelah emang gin chanelnya aku hibur dengan kata kotor if you dislike what he doing just dont look it dumbass kalau ngerti cari dah google translete wahai orang mantab
3027,hahahaha komenan pertama aja dah kaya gitu haters gonna hate sa rugi apa rugi kamu itu buat kamu derita sangatttt yaelah emang gin chanelnya aku hibur kata kotor if you dislike what he doing just dont look it dumbass kalau ngerti cari dah google translete wahai orang mantab
3028,haters kontol kalau suka erickolim usah tonton
3029,aku percaya kamu adalah salah satu contoh internet personality
3030,konten kamu asik bang konten kamu toxic abis bawa bawa saraa
3031,subscriber kok g nambah
3032,ssshhhh bau memek
3033,iklan banyak njing wkwk
3034,dasar kucing kamu erick alat kelamin lelaki hewan kak empat yg suka mengonggong kamu dasar piggy kamu
3035,wkwkwkw haters
3036,udah tato emang erick olim kontol ngentot
3037,dulunya macam tai mulai jilat pantat gua cinta
3038,gua subscribe kamu bqng
3039,ericko lim kontol memek ngentot
3040,titit coly bang plis
3041,harap sekali gua ekspresi kamu waktu baca komen komennya ekspresi antimainstream eh nyata ekspresi persis video reza arap sedikit kecewa gua akspresilu mainstream bang baik bang semangat kontoll
3042,bang kok iklan kondom
3043,biasa a kondom
3044,baru kali wkwkwkw biasanye max tumben
3045,hahahhaha lucu tu orang bang mah orang iri
3046,aku dukung kamu rik aku suka konten konten kamu rik
3047,kontol kamu ric kapan bikin video ngentot ma pacar kamu
3048,satu pihak bang n bikin video ngentot ma pacar kamu
3049,semangat terus bangsatt gua tetep dukung luu pres antimainstream eh nyata ekspresi persis video reza arap sedikit kecewa gua akspresilu mainstream bang baik bang semangat kontoll
3050,ganteng rikkk sumpah gua tetep dukung luu pres antimainstream eh nyata ekspresi persis video reza arap sedikit kecewa gua akspresilu mainstream bang baik bang semangat kontoll
3051,semangat aja erickolim w no erikcolim no life aku suport kamu terus
3052,anggep aja bencong toket
3053,pala aku ijo
3054,hmm bau memeks
3055,erick hatenya banyak si erick tahan
3056,aku suka kamu erick kontol
3057,punya akal sehat tidak milih konten hadehh
3058,aku kangen filty rick
3059,bang bikin challenge ng c k liat foto jesnolimit
3060,usah dipeduliin bang
3061,haters jelas anjenkkkkkkk
3062,lanjutin aja bang
3063,anjing tulis sambung ngentoooooooooooot
3064,mana laki laki ganteng
3065,nah gitu emosi
3066,barusan gua pencet tombol subscribenya kali
3067,aku suka suka aja sama channel meski toxic hibur aku haters bilang channel guna goblok banget kimak
3068,kata suruh unsubscribe
3069,jadi fans hatters tunda dong
3070,tetap semangat terus karya
3071,sprigtrap woi william gua michael anak kamu anjing
3072,buat view gpp wkwk
3073,lah like dah si kontol ni
3074,bego dna
3075,fiks orang dewasa
3076,njirrrr songong
3077,ponakan si ocong yess
3078,g nanya
3079,weeeeeeeeoww
3080,bcod kontoru yess
3081,erikkontol muka kayank sempak kontol anjingg
3082,buat abg yg kata si raja toxic aku pngen nnya kalau ank bawah umur jg ngikutin tingkah laku nya abg kekmana abg para soaper yg pnya akal sehat filter tlg jawab
3083,intro legeds is motherfucking back
3084,haters semua hmmmmmmmm
3085,aku benci kamu udah cukup haters
3086,aku suka konten kamu kok
3087,orang orang nge subscribe luh mau dengar kabar kalau luh delete channel bukan liat muka luh yg pasar ngerti sih ngerti ngerti ngerti
3088,goblok auto unsubcribe
3089,ni channel yg buat reza oktovian delete channel kalau luh sakit hati rendah si reza saran luh buat youtube rewind tolak jangan bawak asa sampe buat video no smile si reza arap balas buat lagu yg smile dn hapus channel bukti kalau ngemis subscribe seperti luh pokony mau tau kamu bujuk reza biar bikin channel kalau aku laporin channel luh yg berapa banyak channel yg lebih besar channel luh contohny miawaug luh mau yg lebih besar yaitu pewdiepie nope kamu ngejek suara reza padahal suara luh lebih parah okay luh seharusny hapus dunia youtube channel luh udah full haters apa luh masih tahan hah si reza yg di channel ny tidak ada haters aja dia nge delete channel gara luuh luh nyadar tidak sih sadar oyyyyyyyyy manusia dajjal mending luh hapus aja channel luh huh dasar emis subscribe
3090,bangsat tertawa bacain komen haters triiigereeeeddd
3091,makan jembut dlu biar benci neng
3092,kocak intro nya njirrr neng
3093,mungkin ric bilang mem k ngilu paling dulu emaknya pas ngelahirin dia makan
3094,wowkwowk makasih ama haters dah nge bantu buat konten u
3095,hahaha hatters goblok hahaha suka ni chanel gausah buka chanel bangsat haha
3096,rick aku akuin kamu emang pintar orang aku tau kok belakang kamu orang kagak toxic emang anjing kamu wkwkwk
3097,kata kata inspirasi
3098,kamu nyangkutin dewa aku
3099,di sosmed aja bang yg berani ngehina kamu kalau ketemu minta foto
3100,ikut bully ahhh biar masuk yucub
3101,walaupun ngomong nyh kya gitu tetep ajh aku tertawa ajg muka cem kontl bikin tertawa
3102,jt subscribe live ngntd
3103,liat iklan sampe habis auto erik kaya auto sedekah auto dapet pahala
3104,youruber yg paling aku banggain
3105,hidup adsense
3106,erickolim beli subscribe terus yg king of youtube indonesia gmna broo
3107,abai haters haters kampang macam begini bang
3108,awkoawkontol tertawa aku bangsad
3109,kalau kamu nyari faedah tidak buka channel faedah bngsti bikin tertawa
3110,sadarrrr guys
3111,aku heran fans erik colim liat betah liat video muka macam biji karat
3112,kualitas suara beda banget
3113,oke di unsubscribe selamat saudara erickolim akan sulit capai jt subscriber tahun selamat nikmat
3114,erick kontol lim pinter nya luar biasa gara gara makan jembuts
3115,haters bangsat terus karya bang erick
3116,makasih bang gua hevun sama cenel kamu
3117,bilang cenel yutub mutu didik baru main yutub nontonnya yutuber on the spot doang mungkin how to basic aja tidak tau
3118,anjing tertawa sumpah liat reaction kamu ajg
3119,haters autis otak digade buat beli diamond mobile legend wkwkwk
3120,hahaha gua kalau nonton channel erick biasa aja gua cuman anggap hibur konten nya yah suka ngomong anjing kontol memek lain hey bagaimana kalian semua nonton arap ngomong anjing bangsat kalian tonton kalian subscribers juga kata suka didik sampah tapi like subscribe tonton sekarang benar sampah kalian bocah orang bego bisa koar komen doang tidak nya sadar diri kalian aja mungkin lebih sampah lebih tolol di real gua malah tertawa lihat haters elu bang erick wkwkkw sekolah perlu lebih serius yah jangan sekolah sampe gerbang doang tidur doang kontol haters tolol kalian ngomong konten nya erick sampah lain kenapa kalian tonton fuck bitch tolol kalian lebih orang yg udah hilang akal sehat youtuber juga punya masing konten mereka buat
3121,i miss pink guy
3122,opening auto njoget
