,ID_Comments
7458,yg baca subscribe mandul ajg
7459,gausah peduliin yg hate kamu rik sudut pandang tu sangat sangat rendah mereka gatau kamu sebenernya
7460,tenang kamu njing aku soapers kamu paling setia jadi terus karya kamu bangsat biarpun banyak haters anggap aja sperma g
7461,sadar lah wahai haters soapking bacod an kalian bakal ngaruh anjink percuma kamu yg goblok sendiri bacod sini koar koar jelas ericknya dapet adsense
7462,kamu emang ganteng rick kamu banyak lemak nya lemak gendut
7463,anti skip skip club kamu banyak lemak nya lemak gendut
7464,kyak diri kamu pas kamu bilang org punya akal sehat jdi tau apa yg di contoh yg enggak wkwkkw anjingg
7465,akhir opening jess is back
7466,langsung bikin bang part nya wkwk
7467,wokwokwowkok tertawa so hard funny jink haters kamu banyak omong mending suruh heat kamu coli jam smpe taun
7468,clickbait tolol
7469,nice
7470,woy gua udah subscribe elu subscribe kamu k gua pernah kasih lope lope sampe skrng bangsat
7471,gausah dengerin bang kata haters
7472,turunin gp anjeng
7473,wahhh son of zeus qorygore mana suara
7474,bang bkin lagu komen hatters donk wkwk gpp wlaupun toxic smuaa
7475,hahahahhlagu komen hatters donk wkwk gpp wlaupun toxic smuaa
7476,gua peduli bang sama komenan kamu bang gua jujur tetep suka sama kamu vang jujur jadi apa ada suka suka hidup sendiri yg penting bahagia bang
7477,paling enak emang ngomong bau memek depan bokin
7478,jangan kalah sama orang yg suka ngejudge kamu rick aku ttp support kamu mimpi aku cuma ken foto bareng sama kamu cuma kapan tetap semangt panutan
7479,kamu pinter kamu rendah hati kamu gapernah sombong kamu baik banget kamu gapernah ngajarin orang jelek semua yg kamu ikan youtube tu pengaruh banget gua jadi makas rick kamu dah jadi orang yg slalu inspirasi buat gua
7480,mantap gayn
7481,allah udah bilang usah tonton udah unsub aja asli kalau punya pikir seni jernih sehat gakusah nonton please
7482,keep toxic yg penting tetep kualitas bang jangan kaya kemarin video gaje iran seni jernih sehat gakusah nonton please
7483,haters kamu kalang org miskin semua rik cari haters yg kaya dikit napa wakakakak
7484,ngentot iklan banyak sekali wkwkwk
7485,baru nama panutan q
7486,kebal
7487,you are the best soapking hxhxhx
7488,tertawa gwe anjenk hahahaha
7489,abang erick biar banyak benci maen game aja biar neng setan setan para benci
7490,meja bufet minimal model simpel cantik
7491,sumpah w tertawa w di net yg tenang aku ketawa sendiri seperti orang sakit jiwa
7492,aku mau coba benci sama erik tu bingung
7493,aku selalu dukung kamu rick slow cukup jadi diri kamu sendiri aja jelas kalau suka sama channel unsub gausah ribet gausah bacot simple
7494,berapa greget kamu kontol
7495,kwwkw mantap haters tebar nyinyir mulu tnggal ush d tonton aja kok repot channel gin aku lucu iya ngehibur iya terus apa salah orng mau buat kontenkalo suka sma konten kamu buat channel sndiri susah ama boong hiya hiya hiya
7496,inti video adalah
7497,terusin aja bakat eriko koment belum sesuai apa yg keti rik gausah tonton lah kontol
7498,walaupun kamu goblk kamu buat gua bahagia
7499,mau ericko dong ahahha
7500,rick please don t disstrack again knp gua bilang kaya gitu kalau kamu mau naik naik lah tanpa jatuh orang okay
7501,aku suka goblok kamu anjing
7502,you born with drama bitches brobrogore
7503,absurd kamu bro
7504,tertawa asw rick
7505,rata benci kamu anak rapstronot bang hahaha dendam kali gara tuhan nya hapus channel hahahaha
7506,sesal aku pura jadi haters
7507,sumpah tertawa aku rikk ers
7508,erick kntl smngat terus dngn chanel tolol luu terus karya kntl wkwk
7509,paling suka w konten ginian awto tertawa
7510,jangan tolol lah kamu semua bocah gblk kamu comment ngatur ericko hak kamu apa pler kamu siapa situ tuhan bukan ajg yg makan jembud yg ngerasain bukan kamu taik yg ken melet nganggu hidup kamu lah tolol jan pelihara mending kamu melihara ayam guna dikit tolol kamu bilang tolol apa lah terus masalah buat kamu apa njing ngaruh ama hidup kamu kamu bilang tidak guna buat negara kamu buta apa kmrn ikut asi games buat indonesia
7511,kontaaall kontooll muke kamu ujung kontoolll anjing dasar kontollll
7512,hahaha hidup pantat tebal
7513,ericko lim pepek bangsat
7514,sabar aja bang ericko bgst gua suka liat video kamu asu terus karya kntl
7515,apa karya apa cara penting bikin rugi kalian bikin rugi bikin cape kalian sndiri hujat orang penting bisa telaah mana yg baik mana yg engga ericko karya apa ada real munafik main setting an
7516,sleding aja yg rasa bocah
7517,intro jess tercury ajg
7518,makin banyak haters makin kaya ng penting bikin rugi kalian bikin rugi bikin cape kalian sndiri hujat orang penting bisa telaah mana yg baik mana yg engga ericko karya apa ada real munafik main setting an
7519,kamu emng bgst aku suka liat tingkah laku looo wkwkwk tingkat goblok brooo
7520,ngehate arti tolol alias manusia tingkat daya humor lawak nya rendah
7521,bang erick kontol bau memek aku suka gaya kamu wkwkwkw
7522,wahai anak anak kontol memek kelen heaters panas daya humor lawak nya rendah
7523,aku dh lama nonton video lain aku kgk subscribe daya humor lawak nya rendah
7524,ko aku tertawa
7525,rick buat gua jadi benci kamu lah bagaimana yak udah terlalu pintar gua mau gua jadi orng tolol biar baca komen nya sama kamu whahaha
7526,daypath wkwkwkk
7527,mulai detik para haters muncul bully bang eric jelas baca coment nya terus upload di youtbe nya bang eric kok tertawa sama haters yg baik mana yg engga ericko karya apa ada real munafik main setting an
7528,ahh kontol haters tiap ericko ngeupload kamu nonton kan anjeng
7529,sekali kontil
7530,nice jembt
7531,eh ngentot t tidak gaada backsound suara teriak tot gua make headset njing kaget gua bangsat
7532,bang gua mau nanya sama kamu jawab gua kepo banget ni kamu sering ngomong anak kampang kan ciri khas orang lampung apa kamu turun orang lampung
7533,coli yuk
7534,subscribe naik wkwk
7535,mantap tod terus haters bonus uang
7536,haters pfft youtube milyaran video banyak channel hibur yg didik tidak nendidik gua subscribe si erick krna gua udah awal paham emang video tidak didik gua tetep subscribe tetep support krna entertainer jadi entertainer kan pokok hibur nggk didik kan
7537,heaters bangsat tertawa kntl ajar inggris dlu todak channel hibur yg didik tidak nendidik gua subscribe si erick krna gua udah awal paham emang video tidak didik gua tetep subscribe tetep support krna entertainer jadi entertainer kan pokok hibur nggk didik kan
7538,kasi haters bacot tetap miskin u todak channel hibur yg didik tidak nendidik gua subscribe si erick krna gua udah awal paham emang video tidak didik gua tetep subscribe tetep support krna entertainer jadi entertainer kan pokok hibur nggk didik kan
7539,hatres datang engkau yg buat soapking makin kayannel hibur yg didik tidak nendidik gua subscribe si erick krna gua udah awal paham emang video tidak didik gua tetep subscribe tetep support krna entertainer jadi entertainer kan pokok hibur nggk didik kan
7540,ytrwd sekarang udah kaga seru kaga jaman arap
7541,kalau mau tenar buat karya sendiri kontol jan bangga dah comment ngotak kalian baca di channel jt subscribe ada faedah ajg
7542,mikir baru ngomong bocah tolol
7543,gabung warpath sama daylen
7544,juta subscribe botak mana kntl
7545,merek kacamata bang erick apa
7546,tertawa bangsata bang erick apa
7547,fuck man i like u shit damn
7548,kalau gamau anak kamu jadi ericko lim gegara nonton vid nya suruh main gundu aja su jangan bolehin liat yt
7549,hari jni aku subscribe kamu nonton video karena aku ngerasa smua orang jg ngomong kasar sering tidak dosa silah ngatain ericko lim
7550,ericko lim yg sebar tak apa kalian pikir
7551,ric pacar kamu buat aku
7552,bapak kau daftar kerja salon
7553,haters kamu banyak bocah kontol rick
7554,sih kalian ngatain erikontol baik padahal beri video didik buat anak buat kalian benci baik tidak boleh bilang erikontol tidak didik soal itu orang paling didik pada kalian
7555,wkwkwkw toxic parah cuk kontol hahaha
7556,channel toxic is wonderfull kalau suka mah jangan channel paling familyfriendly
7557,wad my senpai the bast lah terus kaya lah my senpai kampang
7558,gua subscriber kamu dari dulu waktu jaman digarena dari dulu gua pernah like apa share vidio kamu gua pernah jelekin konten kamu cukup subscribe sama lonceng aja gua dukung gitu btw tyy rick
7559,penting ngentot njing
7560,kamu emng nggk pintar kamu genius
7561,benci kok ngeklick aja aneh
7562,benci sumber uang
7563,bau gore kata please dong bg rickontoru collabs sama qorygore
7564,mantapp lanjutkann sukses terus bang erikontolim wkwk eh salah eriko limbad kok recehh wkwk
7565,kontil
7566,aku bingung yah kok smua haters kamu update yah selalu komen tiap youtube kamu erik jd arti subscriber kamu dong kalau suka comment tiap video kamu aneh yah haters update bhuat comment arti tonton tertawa aku
7567,rik kasih love dong
7568,aku suka chanelnya bang sini hibur kocak bikin stres ilang dikit hehe cuman suka hibur bang r kamu dong kalau suka comment tiap video kamu aneh yah haters update bhuat comment arti tonton tertawa aku
7569,anjayyy hhhh auto tertawa drpd fans arap alay bang arap bang arap bang arap kontollll
7570,anjing gua udah ikutin kamu tarik napas ngomong bau memek qkqkkqqk tertawa asli
7571,first time comment
7572,erik ngentot sama guwe yuk yg suka lek
7573,iklan bisa skip anjg
7574,anjink wlau soapers kq aku neng liat kamu nyampah peppek memang mantap kontol kau memek kentod
7575,aku yakin haters ericko lim fansnya si arap toket mending kalian pulang sono jilat kaki kapten kamu hahaha dasar kontol
7576,wkkwkw ini haters goblok murni tuhan wkwkwk suka ush sini gblk di sini bukan buat kaum pantat tipis wkkwkw welcome to internet kids kamu kasih makan terus orang tampil apa kamu mau gitu mikir wkkwkwk kenal tidak goblok
7577,bikin q a sama mama u dong konyol sumpah tertawa
7578,komen pertama dibacain ericko lim aku haru
7579,keren kamu bang ericko limn ericko lim aku haru
7580,mantappp ericko limn ericko lim aku haru
7581,yucuber pantat t e r t e b a l
7582,ngukuq aing
7583,edit elu mantap kontoru l
7584,anja auto tertawa ru l
7585,naise opening favoritu l
7586,ericko lim ajig kamu seru walaupun konten unfaedah ngehibur rik hibur lk di sini bukan buat kaum pantat tipis wkkwkw welcome to internet kids kamu kasih makan terus orang tampil apa kamu mau gitu mikir wkkwkwk kenal tidak goblok
7587,bikin part rik
7588,liat video panutan qyuh aku baru tau kalau memek ngilu
7589,ngeliat lgi tu intro jes wkwk
7590,ngentot menit udah rebu aja like nya mantap rik
7591,kangen anjir ama opening
7592,upload vidio ngentod kamu rick tuju like
7593,i like it intro tetetetetet
7594,ngatain reza view nya kaya gurun padahal video lho yg view nya kaya gurun cuma k view bangga kontol malah lebih banyak punya reza erico kontol makan jmbt aja sana lho kontol
7595,bang kocak banget episode n padahal video lho yg view nya kaya gurun cuma k view bangga kontol malah lebih banyak punya reza erico kontol makan jmbt aja sana lho kontol
7596,bener kamu lim banyak haters banyak duit
7597,my king im always support you
7598,gausah dengerin hatersampah bang tentu jg bener
7599,mantap cuy dulu gua subscribe kamu pas garena stay for you cokkk ericolim kontol aku selalu nonton video kamu soal konten kamu hibur walaupun faedah haters nama haters jago ngomong cuman dunia maya doang asli mental tempe
7600,semangat aja erik kntl
7601,eriko mah ganteng gitu lohhhhhhhhhhhhh
7602,bang gua dh subscibe kok ada tanda merah kamu boong kamu bang
7603,cie nge stack jt
7604,bang awal nya gua subscribe kamu terus pas kamu udah kaya gua unsubscribe chenel kamu keren nga gua nton video kamu soal konten kamu hibur walaupun faedah haters nama haters jago ngomong cuman dunia maya doang asli mental tempe
7605,orang yg baik liat cara bicara chanel kamu bukan orang dewasa aja yg nntn anak anak ada kalau ank anak sana nyontoh elu cara bicara kamu yg kaya gitu bagaimana please lah mikir
7606,kalau bener si bovo yt rewind yutuber auto unsub
7607,harus bahasa luar kamu jangan bawa video youtube tonton anak kecil dewasa makan orang tidak neng sama kamu bahasa kamu kalau video si hibur cuma bahasa gapantes
7608,tenang erick kontol iklan gua skip
7609,banyak ngomong anjing kamu mirip ama si stop rik cari kata kasar untuk daily bad work kamu memek misal ny
7610,rick kalau bikin vidio baca
7611,oke aku ngerti kamu sibuk ngurusin ytr kamu coba bikin video buat ngehibur soapers rik thx
7612,aku ngerti kamu sibuk ngurusin ytr kamu coba bikin video buat ngehibur soapers rik thx
7613,anjing bangsat tolol ngentot gua haters kamu just kidding bikin konten lebih hibur aja rick proud of u
7614,haters auto kesel trigger mampus kau haters
7615,kalau otak mah lah mi mana yg baik mana yg buruk
7616,laaaahhhhhh rb likeeeee yaaaaaaa yg baik mana yg buruk
7617,dasar anak lacur mamak kamu lacur jalan mana
7618,aku nonton asa hibur njir selalu tertawa aku kalau nonton kamu lim buat haters kalau suka tidak usah nontong anjing ribet banget kamu kadal mesir enghibur cuma bahasa gapantes
7619,haternya banyak fans mr ro wkwkkwkw
7620,jangan banyak bacot anjing anti baper bangsat
7621,bg rekrut agung hapsah jadi sodaro kamu mirip sekali dah kamu nonton kamu lim buat haters kalau suka tidak usah nontong anjing ribet banget kamu kadal mesir enghibur cuma bahasa gapantes
7622,btw aku suka gaya kamu erick abai jh yang ngehina kamu jelas
7623,gua inget wkt dlu kamu di gar na wkt subscribe puluan ribu waktu live banned citer tatto kamu banyak sekarang but its
7624,bang erico paling kocak
7625,bang aku dh tahun subscribe channel kamu x aja pernah kamu like kasi emot di comment aku u banyak sekarang but its
7626,ashiaap
7627,upgrade pantad cuy biar kebal bait
7628,haters makhluk munafik gasuka tonton tau didik penasaran ken liat kalau emang faedah kata perilaku gausah di cerna pake otak tolol dasar biji hylos
7629,oke comeback kamu toxic bang aku neng kamu dulu kaya gin kamu upmood aku bang
7630,idup jngan dibwa pusing jalanin aja yg kamu suka kalau suka tinggalin susah
7631,abg gua bukan kaleng kaleng hehe
7632,kocak wkwkwkwk
7633,top komen besok mati
7634,diemin aja anak hasil condom bocor nge diss kamu rick semangat terus buat konten faedah
7635,netijen indonesia the best netijen dunia ss kamu rick semangat terus buat konten faedah
7636,hahahaha sabar bang ericko lim semangat teruslo rick semangat terus buat konten faedah
7637,ochin chin daisuki
7638,juta bilang ada yg percaya wkwkwkwkwk
7639,haters haters lah mending aku nonton biar dapet hibur yoi bang udel mendem lanjutin lah kontol ehh bego anjing ngentot wehh seru uga haters bang udel mendem aku kasih saran kamu semua benci jadi orang mikir kamu jadi benci apa faidahnya ngotak dikit ngapa komenin gakjelas doang gitu udah tau bang udel mendem kan emang baik ngasih tau bang udel mendem nama hibur kamu kalau mau liat vidio baik baik nonton tv aja kamu bang udel mendem chanel yanv bahagia aku belum aku mau ngatain kamu dulu biar kamu tambah semangat fuckkk ngentot kuda anak udeh gitu aja dah untuk kamu project kamu bikin lancar biar biariin
7640,idola dahhhhh mending aku nonton biar dapet hibur yoi bang udel mendem lanjutin lah kontol ehh bego anjing ngentot wehh seru uga haters bang udel mendem aku kasih saran kamu semua benci jadi orang mikir kamu jadi benci apa faidahnya ngotak dikit ngapa komenin gakjelas doang gitu udah tau bang udel mendem kan emang baik ngasih tau bang udel mendem nama hibur kamu kalau mau liat vidio baik baik nonton tv aja kamu bang udel mendem chanel yanv bahagia aku belum aku mau ngatain kamu dulu biar kamu tambah semangat fuckkk ngentot kuda anak udeh gitu aja dah untuk kamu project kamu bikin lancar biar biariin
7641,alwi isra kamu tau sejarah erick cuk
7642,palkon gaming sama
7643,salam soapers sejak dulu live pb tiap malem
7644,fans ny jg
7645,erick jd soapking kampanggg
7646,mana si iklan kondom
7647,lucu kamu kampanh
7648,udah botak palak baawah nya
7649,biarin bae bang benci kaga punya otak
7650,moga subscribe bang erik nambah benci jangan suka ngebuli orang ini udah ngedit lama ampe tidur kamu ngejeg enak dasar para benci kontol
7651,dapat jess yg pedo
7652,bang kamu ngefans youtuber luar siapa bang fans kamu bakal jdi kyak kamu
7653,absen rik kamu
7654,awas kamu malah giveaway akun wkwk
7655,yea intro w tunggu tunggu
7656,ngehate mungkin fans si anjing bro
7657,edit mantull njingg keren
7658,keep soapers h keren
7659,didik sekali h keren
7660,menit daylen bukan hahaing bro
7661,saling subscribe yok
7662,inti gin aja collab yok buat rewind youtube
7663,wkwkwkwk tertawa anjing
7664,bang rik sama victory xd dong video
7665,c h a n n e l k e l u a r g a t a p i n g o m o n g n y a m m k k n t l ment lucu anjir
7666,didik sejak tk orang indonesia biar ngilangin sifat bully
7667,aku subscribe erik nonton terus konten aku mau jdi org yg trkhir subscribe ericksalah orang yg bully negara
7668,asli semenjak aku subscribe chanel kamu mulut aku seperti bonbin bully negara
7669,bang dateng dong pensi oktober tunggu krhadirannya
7670,wkwkwk bisa ngehate doang ada iri mereka
7671,lanjut erick kontol krna prilaku sifat jamin diri kamu buruk yg kira
7672,i love you kontoruuuuuuuuuuuuuuuuuuuuuuu
7673,motivasi anjir tertawa wkwkkwkwk motivasi sekali
7674,kau tetap jadi toxic ericko jadi diri sendiri haters become your money
7675,buat haters gausah komen sini kalau kamu cari konten didik tonton mata najwa geolive id cameo project
7676,buat erickntl tetap lah jadi kntl kita kenal bgst
7677,ah gila memek ngilu wkwkwk
7678,channel buat hibur
7679,aku tonton iklan no skip klep
7680,ericko lim jangan jadiin gwe panutan idola kalian jadiin gwe hibur buat kalian
7681,kntl
7682,aku suka gaya kamu kali kali makan kontol lah jangan jembut mulu
7683,gud rick makin sukses depan
7684,aku bingung kenapa benci kamu bilang konten vidio faedah mutu mereka ujung nya liat konten vidio kamu
7685,kontol sangat keren eh maksud ku kontol eh kontol konten anjing
7686,tetap semangat aja erick jagan putus asa heaters cape bully rekening jalan terus tetap upload video jagan serah jagan serah terus karya jagan hirau heaters anggap angin lewat tetap semangat erickolim
7687,hahahaha betul the rick komen bacot bisa paham
7688,si erickkontoru cocok jadi tri didik biar anak dapat kurikulum yg timpal
7689,haters erickolim auto kaya
7690,alah harus haters
7691,bang kamu berapa kali hari ngomong kont l sama anjig bagsat tolol goblok ngetot
7692,orang nontn channel cma mau liat orang gila kecil aja suka ngeledekin nontonin orang gila jadi wajar lah orang nonton kalau bicara soal skill lebih gua rasa kamu gua punya
7693,rik kamu tau salah kamu pas ngajak arap kamu arap baik baik sela arap sibuk bilang bisa salah kamu sini terus kamu bilang elu engga elu yt rewind bakal turut gua ucap cukup ngeggas arap singgung dong arap sabar arap cuman bilang baper kamu ntah apa masalah nya hingga arap komen yt elu elu pantes nge hendel yt rewind kanapa arap ngomong karana arap terjun di dunia ytb udah lama udah alam yt rewind indonesia bukan projek kecil rik sorry gua cuman ambil simpul si terimakasih
7694,kagak usah bela erick mah juga kagak peduli ma gituan
7695,panutanq erick kontol love you pokonyamah unchumchunch
7696,lama kalau gua liat kok kamu mirip marloernesto yak gaya kamu rick wkwkwk sama konyol anjirrrr
7697,reacthaters kedokmarahtidakdiberijatahmalemjumat
7698,makin banyak ngediss makin kaya haha
7699,kasih tau rik kalau orang kontol kaya kamu bikin youtube rewind paling ingat ingat panjang masa
7700,tertawa wkwk
7701,ngegas mulu anjing erick biasa kontol gua suka ngegas kamu lucu muka kamu karet bakar
7702,anjing rip telinga aku pas dwtik pertama kontol
7703,rik kamu masuk mli dong ganti muslim ama cok
7704,o masuk mli dong ganti muslim ama cok
7705,iklan kamu banyak banget anjing
7706,bau gor hhhh
7707,cok muslim mana woy cok muslim
7708,hahha benci jadi duit tod anggap aja kontol guna wkwkwkw
7709,yeaahhhhhhhhhhhhh sayanos merasanos terhiburnos denganos kontenos ininos jadi nos kamunos harusbos buat laginos yeaaahaaahaahhahhjj trimakasihhhhh yakulllllllllllllttttt ngentot mpusssssssshshhh bau memek
7710,jangan lupa coli
7711,high comment
7712,goblok nihh yg ngehatrs kamu bocah smua bang gosa dengerin bocah kecil bau ketek gitu bang haha
7713,rik aku soapers kntl titik
7714,bangsat iklan ml anjing
7715,aku nonton haters nonton cebong sama kampret gelut wkwkwkwk nonton aja dah penting kamu tetep jadi panutan aku all hail lord kontoru salakulllllllllllllttttt ngentot mpusssssssshshhh bau memek
7716,iklan awal ampe akhir aku skipp
7717,kamu bilang takut anak kecil ikutin kamu bilang masing masing punya akal sehat mana yg baik mana yg buruk kamu mikir nama anak kecil
7718,gara gua penasaran gua rela nonton iklan nyampe detikaaaannn gilaaaaaaaa lebih faedah ketimbang omong kamu tidak penting erikkkk
7719,bukan soal suka tidak suka pikir adek yg nonton channel kamu malah niru gaya ngomong kamu seperti sampah masyarakat
7720,suka kok nonton goblok sampe dna
7721,si daylen anjing haha
7722,woy hetters hetters tolol kamu ngomenin ericko jelek emang kamu jadi kaya eric hatters tolol
7723,sabar bro hina an adalah motivasi dapat rezeki
7724,sianjing endingnya dilamain mntin biar dapet adsence kontol emang kamu rik xd
7725,sabar lah semangat bangn mntin biar dapet adsence kontol emang kamu rik xd
7726,b a u m m k
7727,aku haters aku kok baik yein biar dapet adsence kontol emang kamu rik xd
7728,aku sukak sama loo bg ada munak nya sama sekali
7729,kok presiden
7730,help gua pake henset hik
7731,rick kamu inget aku aku mantan kamu pernah diewe samalu rickgw roy kimochi rick
7732,makin neng gua kalau gin
7733,laporannn iklannnya tonton habiss tanps skip wkwkwkw
7734,iklan kamu aku skip rik aku lebih suka iklan yg dichannel yucub kamu lebih bervaedah iklan pada konten vidionya
7735,erikontol kaga sesal aku subscribe kamu perak
7736,bangggg woiiiii eluu emanggg berfaeedaaahhh baggiii moodddd guaaaaaa buat konten yg faedah bang pada lain
7737,kim pansos
7738,bilang indonesia mayoritas muslim semua sama kontol ngentot kamu anjing negara negara agama agama kentod lah
7739,bang gua nonton video kamu awal pas kamu ngomong suruh subscribe gua langsung subscribe keren bang rick
7740,semngat kntl
7741,gua subscribe gua ngrsa hibur gua suka gua subscribe baek nya gua ambil jlk nya abai yang jls gua nnton gua suka chnl yang gua suka boro gua subscribe d tonton kagak
7742,benci kontol gua pihak erick anjing coment jahat kamu yg guna malah bikin erick makin semangat buat bikin vidio hhhhhh sungguh haru buat benci bocah kampung
7743,bacot mulu kaya bocah ml
7744,bikin video wik wik wik sama ody rick
7745,fachrur rozi s wkwk biasa heaters yg cari sensasi doank bro biar orang bela dn yg paling bner aku ttap dukung ericko aja
7746,oke sama anti skip klep
7747,bang gua kemaren makan sumpit pake bubur
7748,youtube sebenernya fokus sarana hibur misal bilang kalau buat chanel yg didik bagaimana harus orang orang diarahin buat ajar baca baca jurnal artikel berita bukan main youtube
7749,lah anjing ngentot bacot aja kamu orang babi bangsad biarin emng sifat si erick geh youtubers punya ciri khas sendiri anjing
7750,kaloo mau liat konten kontek faedah didik kamu nonton channel calon sarjana aja anjink ericolim emg kaya gin kontol bajing emg si eric mah tai
7751,gua bukan haters cuman netizen pikir anak kecil yg nonton tod
7752,haters bilang konten didik konten bodoh hey haters anjing si erik salah haters bodoh kamu minta channel yg didik channel yg bikin kamu pinter kamu nonton channel aja anjing tidak usah tonton channel yg kaya tai gin kamu haters kamu semua salah berekspektasi eriko lim yg minta bikin konten yg didik salah besar kalau bego jangan diexpost please
7753,ingat boss buka hatters gblk channelnya aja yg sampah
7754,meet up sma reza arap
7755,kek comment haternya buat buat
7756,chanel kontol bagus
7757,gans parah ol bagus
7758,semangat terus bang hatters dikarungin aja tuju like
7759,haters jadi doetttttttt
7760,paling kalau buat channel yg didik yg nonton bukan org dewasa doang pikir adek yg nonton channel kamu jga dong malah tiru kata kata yg faedah dasar lemah dasar payah hadehh mau bawa adek nya malah jadiin adek jadi
7761,kok muka sekarang cerah kemarin pas sama victoria dekill sekali wokwokwok efek cahaya lampi yaaa wokwowk skidipapap
7762,haters baik nya diam aja usah urusin orang lah kalau kalian nonton subscribe like dulu baru nge bully ngentot anak kontol
7763,suka cabut kalau suka tetap stay anjing btw aku suka chanel anjing
7764,suka cabut kalau suka tetap stay anjing btw aku suka chanel anjing
7765,bacott kontol
7766,anti skip skip iklan club tetap stay anjing btw aku suka chanel anjing
7767,haters mending ngentot sama tembok gih sana wkwk
7768,cuma plagiat pink guy
7769,mantulll
7770,filthy frank indonesian version
7771,hadeh dasarhaters kontol kamu semua anjing
7772,hate comen nyemangatin erick buat bikin konten adsanse cuk
7773,pak
7774,kalau ken pintar cari chanel yg didik kalau cari hibur tonton chanel eric mikir kontol
7775,tertawa bangsdd bikin prt nya lah erikontol proses no limit
7776,suka lucu kalau liat orang tolol komen agama kamu siapa anjg nentuin video bang erick pantes tidak buat tonton ama orang dasar tolol mau bilang pinter tolol e liat
7777,jadi hatersnya ericko lim anak lahir pantat ditusbol pake kontol patah wkwkwkwkwwk anak kontol dong yang hate sama ericko lim
7778,yah gua tau bang kamu bego gua bakal ngikutin kamu
7779,jangan lupa subscribe channel kamu perlu ingat kalau aku dulunya selingkuh kamu
7780,buat music bang lagu elo didik
7781,pantat kamu tebel bang
7782,mantaaaap
7783,mending kamu sodakohkan channel youtube kamu saya biar berkah
